{
  "$schema":"https://json-schema.org/draft/2020-12/schema","$id":"https://agent-memory.local/schemas/evidence/v1/staging-security-closure-input.schema.json","title":"Agent Memory staging security finding closure input","type":"object","additionalProperties":false,
  "required":["schema","classification","environment","review_id","register_version","scope_version","inventory_id","inventory_receipt_sha256","plan_id","plan_receipt_sha256","change_id","change_receipt_sha256","release_id","release_receipt_sha256","source_manifest_sha256","finding_register_sha256","classification_policy_sha256","retest_report_sha256","security_review_sha256","snapshot_at","reviewed_at","generated_at","ready","sources","findings","checks"],
  "properties":{"schema":{"const":"agent-memory-staging-security-closure-input-v1"},"classification":{"const":"staging_external"},"environment":{"const":"staging"},"review_id":{"$ref":"#/$defs/opaque"},"register_version":{"$ref":"#/$defs/opaque"},"scope_version":{"$ref":"#/$defs/opaque"},"inventory_id":{"$ref":"#/$defs/opaque"},"inventory_receipt_sha256":{"$ref":"#/$defs/digest"},"plan_id":{"$ref":"#/$defs/opaque"},"plan_receipt_sha256":{"$ref":"#/$defs/digest"},"change_id":{"$ref":"#/$defs/opaque"},"change_receipt_sha256":{"$ref":"#/$defs/digest"},"release_id":{"$ref":"#/$defs/opaque"},"release_receipt_sha256":{"$ref":"#/$defs/digest"},"source_manifest_sha256":{"$ref":"#/$defs/digest"},"finding_register_sha256":{"$ref":"#/$defs/digest"},"classification_policy_sha256":{"$ref":"#/$defs/digest"},"retest_report_sha256":{"$ref":"#/$defs/digest"},"security_review_sha256":{"$ref":"#/$defs/digest"},"snapshot_at":{"type":"string","format":"date-time"},"reviewed_at":{"type":"string","format":"date-time"},"generated_at":{"type":"string","format":"date-time"},"ready":{"type":"boolean"},"sources":{"type":"array","minItems":4,"maxItems":4,"items":{"$ref":"#/$defs/source"}},"findings":{"type":"array","maxItems":10000,"items":{"$ref":"#/$defs/finding"}},"checks":{"type":"array","minItems":7,"maxItems":7,"items":{"$ref":"#/$defs/check"}}},
  "$defs":{"digest":{"type":"string","pattern":"^[a-f0-9]{64}$"},"opaque":{"type":"string","pattern":"^[A-Za-z0-9][A-Za-z0-9._:-]{0,127}$"},"source_id":{"enum":["application_penetration","tenant_isolation","dependency_supply_chain","container_image"]},"check_id":{"enum":["assessment_source_exports_complete","assessment_scope_coverage_complete","severity_and_exploitability_classified","finding_register_reconciled","critical_high_remediation_closed","critical_high_independent_retests_passed","security_release_review_complete"]},"outcome":{"enum":["passed","failed","inconclusive"]},"source":{"type":"object","additionalProperties":false,"required":["id","outcome","expected_target_count","observed_target_count","evidence_sha256"],"properties":{"id":{"$ref":"#/$defs/source_id"},"outcome":{"$ref":"#/$defs/outcome"},"expected_target_count":{"type":"integer","minimum":1,"maximum":100000000},"observed_target_count":{"type":"integer","minimum":1,"maximum":100000000},"evidence_sha256":{"$ref":"#/$defs/digest"}}},"finding":{"type":"object","additionalProperties":false,"required":["fingerprint_sha256","severity","exploitability","state","retest_outcome","evidence_sha256"],"properties":{"fingerprint_sha256":{"$ref":"#/$defs/digest"},"severity":{"enum":["critical","high","medium","low"]},"exploitability":{"enum":["exploitable","not_exploitable","inconclusive"]},"state":{"enum":["open","closed"]},"retest_outcome":{"enum":["passed","failed","inconclusive","not_required"]},"evidence_sha256":{"$ref":"#/$defs/digest"}}},"check":{"type":"object","additionalProperties":false,"required":["id","outcome","evidence_sha256"],"properties":{"id":{"$ref":"#/$defs/check_id"},"outcome":{"$ref":"#/$defs/outcome"},"evidence_sha256":{"$ref":"#/$defs/digest"}}}}
}
