{"schema":"agent-memory-staging-security-closure-input-v1","classification":"staging_external","environment":"staging","review_id":"security-closure-2026","register_version":"register-v1","scope_version":"scope-v1","inventory_id":"staging-inventory","inventory_receipt_sha256":"aaaaaaaaaaaaaaaaaaaaaaaaaaaaaaaaaaaaaaaaaaaaaaaaaaaaaaaaaaaaaaaa","plan_id":"staging-plan","plan_receipt_sha256":"bbbbbbbbbbbbbbbbbbbbbbbbbbbbbbbbbbbbbbbbbbbbbbbbbbbbbbbbbbbbbbbb","change_id":"staging-change","change_receipt_sha256":"cccccccccccccccccccccccccccccccccccccccccccccccccccccccccccccccc","release_id":"staging-release","release_receipt_sha256":"dddddddddddddddddddddddddddddddddddddddddddddddddddddddddddddddd","source_manifest_sha256":"eeeeeeeeeeeeeeeeeeeeeeeeeeeeeeeeeeeeeeeeeeeeeeeeeeeeeeeeeeeeeeee","finding_register_sha256":"ffffffffffffffffffffffffffffffffffffffffffffffffffffffffffffffff","classification_policy_sha256":"1111111111111111111111111111111111111111111111111111111111111111","retest_report_sha256":"2222222222222222222222222222222222222222222222222222222222222222","security_review_sha256":"3333333333333333333333333333333333333333333333333333333333333333","snapshot_at":"2026-08-10T12:00:00Z","reviewed_at":"2026-08-10T13:00:00Z","generated_at":"2026-08-10T14:00:00Z","ready":true,"sources":[{"id":"application_penetration","outcome":"passed","expected_target_count":10,"observed_target_count":10,"evidence_sha256":"4444444444444444444444444444444444444444444444444444444444444444"},{"id":"tenant_isolation","outcome":"passed","expected_target_count":10,"observed_target_count":10,"evidence_sha256":"5555555555555555555555555555555555555555555555555555555555555555"},{"id":"dependency_supply_chain","outcome":"passed","expected_target_count":10,"observed_target_count":10,"evidence_sha256":"6666666666666666666666666666666666666666666666666666666666666666"},{"id":"container_image","outcome":"passed","expected_target_count":10,"observed_target_count":10,"evidence_sha256":"7777777777777777777777777777777777777777777777777777777777777777"}],"findings":[{"fingerprint_sha256":"8888888888888888888888888888888888888888888888888888888888888888","severity":"critical","exploitability":"exploitable","state":"closed","retest_outcome":"passed","evidence_sha256":"9999999999999999999999999999999999999999999999999999999999999999"},{"fingerprint_sha256":"aaaaaaaaaaaaaaaaaaaaaaaaaaaaaaaaaaaaaaaaaaaaaaaaaaaaaaaaaaaaaaaa","severity":"high","exploitability":"not_exploitable","state":"open","retest_outcome":"not_required","evidence_sha256":"bbbbbbbbbbbbbbbbbbbbbbbbbbbbbbbbbbbbbbbbbbbbbbbbbbbbbbbbbbbbbbbb"}],"checks":[{"id":"assessment_source_exports_complete","outcome":"passed","evidence_sha256":"aaaaaaaaaaaaaaaaaaaaaaaaaaaaaaaaaaaaaaaaaaaaaaaaaaaaaaaaaaaaaaaa"},{"id":"assessment_scope_coverage_complete","outcome":"passed","evidence_sha256":"aaaaaaaaaaaaaaaaaaaaaaaaaaaaaaaaaaaaaaaaaaaaaaaaaaaaaaaaaaaaaaaa"},{"id":"severity_and_exploitability_classified","outcome":"passed","evidence_sha256":"aaaaaaaaaaaaaaaaaaaaaaaaaaaaaaaaaaaaaaaaaaaaaaaaaaaaaaaaaaaaaaaa"},{"id":"finding_register_reconciled","outcome":"passed","evidence_sha256":"aaaaaaaaaaaaaaaaaaaaaaaaaaaaaaaaaaaaaaaaaaaaaaaaaaaaaaaaaaaaaaaa"},{"id":"critical_high_remediation_closed","outcome":"passed","evidence_sha256":"aaaaaaaaaaaaaaaaaaaaaaaaaaaaaaaaaaaaaaaaaaaaaaaaaaaaaaaaaaaaaaaa"},{"id":"critical_high_independent_retests_passed","outcome":"passed","evidence_sha256":"aaaaaaaaaaaaaaaaaaaaaaaaaaaaaaaaaaaaaaaaaaaaaaaaaaaaaaaaaaaaaaaa"},{"id":"security_release_review_complete","outcome":"passed","evidence_sha256":"aaaaaaaaaaaaaaaaaaaaaaaaaaaaaaaaaaaaaaaaaaaaaaaaaaaaaaaaaaaaaaaa"}]}
